<xsd:schema xmlns:xsd="http://www.w3.org/2001/XMLSchema">
<xsd:element name="personas">
   <xsd:complexType>
         <xsd:sequence>
         <xsd:element name="persona" maxOccurs="unbounded">
         <xsd:complexType>

         <xsd:sequence>
         <xsd:element name="nombre" type="xsd:string" maxOccurs="unbounded"/>
         <xsd:element name="apellido1" type="xsd:string"/>
         <xsd:element name="apellido2" type="xsd:string" minOccurs="0"/>
         <xsd:element name="telefono" type="xsd:string" minOccurs="0" maxOccurs="2"/>
         <xsd:element name="edad" type="xsd:string"/>
         <xsd:element name="lugar_nacimiento" type="xsd:string"/>
         <xsd:element name="codigo_postal" type="xsd:string"/>

         <xsd:element name="edad">
          <xsd:simpleType>
            <xsd:restriction base="xsd:integer">
            <xsd:minInclusive value="0"/>
            <xsd:maxInclusive value="110"/>
            </xsd:restriction>
          </xsd:simpleType>
         </xsd:element>
        <xsd:element name="lugar_nacimiento">
        <xsd:simpleType>
            <xsd:restriction base="xsd:string">
               <xsd:minLength value="4"/>
               <xsd:maxLength value="45"/>
            </xsd:restriction>
        </xsd:simpleType>
        </xsd:element>
        <xsd:element name="codigo_postal">
         <xsd:simpleType>
            <xsd:restriction base="xsd:integer">
               <xsd:pattern value="[0-9]{5}"/>
            </xsd:restriction>
         </xsd:simpleType>
        </xsd:element>
        </xsd:sequence>
         <xsd:attribute  name="nacionalidad" type="xsd:string"  use="optional"/>
         <xsd:attribute name="id_persona" type="xsd:string" use="required"/>
        </xsd:complexType>
        </xsd:element>
        </xsd:sequence>
    </xsd:complexType>
</xsd:element>
</xsd:schema>                                                       
