<?xml version="1.0" encoding="UTF-8"?>
<personas xmlns:xsi="http://www.w3.org/2001/XMLSchema-instance"   xsi:noNamespaceSchemaLocation="personas.xsd" >
    <persona nacionalidad="española" id_persona="A1111">
        <nombre>Rosa</nombre>
        <nombre>Clara</nombre>
        <apellido1>Casas</apellido1>
        <apellido2>Rueda</apellido2>
        <edad>23</edad>
        <lugar_nacimiento>Torrejón de Ardoz</lugar_nacimiento>
        <codigo_postal>28850</codigo_postal>
    </persona>
    <persona id_persona="B2222">
        <nombre>Sergio</nombre>
        <apellido1>Fuentes</apellido1>
        <apellido2>Rio</apellido2>
        <telefono>911111111</telefono>
    </persona>
    <persona nacionalidad="francesa" id_persona="C3333">
        <nombre>Lorena</nombre>
        <apellido1>Madrid</apellido1>
        <telefono>912222222</telefono>
        <telefono>601222222</telefono>
        <edad>27</edad>
    </persona>
    <persona id_persona="D4444">
        <nombre>Carlos</nombre>
        <apellido1>Flores</apellido1>
    </persona>
</personas>